PassengerId,Survived,Pclass,Name,Sex,Age,SibSp,Parch,Ticket,Fare,Cabin,Embarked
360,0,3,"Barbara, Mrs. (Catherine David)",female,73,0,1,2691,14.4542,Z169,C
361,0,3,"Asim, Mr. Adola",male,16,0,0,SOTON/O.Q. 3101310,7.05,V722,S
362,0,3,"O'Brien, Mr. Thomas",male,47,1,0,370365,15.5,R260,Q
363,0,3,"Adahl, Mr. Mauritz Nils Martin",male,47,0,0,C 7076,7.25,I664,S
364,1,1,"Warren, Mrs. Frank Manley (Anna Sophia Atkinson)",female,79,1,0,110813,75.25,V826,C
365,1,3,"Moussa, Mrs. (Mantoura Boulos)",female,63,0,0,2626,7.2292,U745,C
366,1,3,"Jermyn, Miss. Annie",female,61,0,0,14313,7.75,O376,Q
367,1,1,"Aubart, Mme. Leontine Pauline",female,66,0,0,PC 17477,69.3,U757,C
368,1,1,"Harder, Mr. George Achilles",male,53,1,0,11765,55.4417,M843,C
369,0,3,"Wiklund, Mr. Jakob Alfred",male,16,1,0,3101267,6.4958,R443,S
370,0,3,"Beavan, Mr. William Thomas",male,54,0,0,323951,8.05,T347,S
371,0,1,"Ringhini, Mr. Sante",male,71,0,0,PC 17760,135.6333,N269,C
372,0,3,"Palsson, Miss. Stina Viola",female,71,3,1,349909,21.075,T613,S
373,1,1,"Meyer, Mrs. Edgar Joseph (Leila Saks)",female,27,1,0,PC 17604,82.1708,Q982,C
374,1,3,"Landergren, Miss. Aurora Adelia",female,38,0,0,C 7077,7.25,N257,S
375,0,1,"Widener, Mr. Harry Elkins",male,49,0,2,113503,211.5,D356,C
376,0,3,"Betros, Mr. Tannous",male,68,0,0,2648,4.0125,W621,C
377,0,3,"Gustafsson, Mr. Karl Gideon",male,19,0,0,347069,7.775,N950,S
378,1,1,"Bidois, Miss. Rosalie",female,19,0,0,PC 17757,227.525,W678,C
379,1,3,"Nakid, Miss. Maria (""Mary"")",female,23,0,2,2653,15.7417,F283,C
380,0,3,"Tikkanen, Mr. Juho",male,28,0,0,STON/O 2. 3101293,7.925,E266,S
381,1,1,"Holverson, Mrs. Alexander Oskar (Mary Aline Towner)",female,77,1,0,113789,52,D503,S
382,0,3,"Plotcharsky, Mr. Vasil",male,41,0,0,349227,7.8958,X843,S
383,0,2,"Davies, Mr. Charles Henry",male,74,0,0,S.O.C. 14879,73.5,R467,S
384,0,3,"Goodwin, Master. Sidney Leonard",male,23,5,2,CA 2144,46.9,B662,S
385,1,2,"Buss, Miss. Kate",female,71,0,0,27849,13,O301,S
386,0,3,"Sadlier, Mr. Matthew",male,25,0,0,367655,7.7292,C360,Q
387,1,2,"Lehmann, Miss. Bertha",female,80,0,0,SC 1748,12,K389,C
388,1,1,"Carter, Mr. William Ernest",male,12,1,2,113760,120,N311,S
389,1,3,"Jansson, Mr. Carl Olof",male,9,0,0,350034,7.7958,W960,S
390,0,3,"Gustafsson, Mr. Johan Birger",male,14,2,0,3101277,7.925,N928,S
391,1,1,"Newell, Miss. Marjorie",female,69,1,0,35273,113.275,U515,C
392,1,3,"Sandstrom, Mrs. Hjalmar (Agnes Charlotta Bengtsson)",female,28,0,2,PP 9549,16.7,U602,S
393,0,3,"Johansson, Mr. Erik",male,38,0,0,350052,7.7958,K478,S
394,0,3,"Olsson, Miss. Elina",female,67,0,0,350407,7.8542,D574,S
395,0,2,"McKane, Mr. Peter David",male,33,0,0,28403,26,S430,S
396,0,2,"Pain, Dr. Alfred",male,60,0,0,244278,10.5,M980,S
397,1,2,"Trout, Mrs. William H (Jessie L)",female,58,0,0,240929,12.65,J586,S
398,1,3,"Niskanen, Mr. Juha",male,20,0,0,STON/O 2. 3101289,7.925,S506,S
399,0,3,"Adams, Mr. John",male,44,0,0,341826,8.05,J284,S
400,0,3,"Jussila, Miss. Mari Aina",female,61,1,0,4137,9.825,R664,S
401,0,3,"Hakkarainen, Mr. Pekka Pietari",male,42,1,0,STON/O2. 3101279,15.85,I661,S
402,0,3,"Oreskovic, Miss. Marija",female,48,0,0,315096,8.6625,L347,S
403,0,2,"Gale, Mr. Shadrach",male,52,1,0,28664,21,K848,S
404,0,3,"Widegren, Mr. Carl/Charles Peter",male,68,0,0,347064,7.75,Z437,S
405,1,2,"Richards, Master. William Rowe",male,36,1,1,29106,18.75,Q666,S
406,0,3,"Birkeland, Mr. Hans Martin Monsen",male,80,0,0,312992,7.775,N731,S
407,0,3,"Lefebre, Miss. Ida",female,59,3,1,4133,25.4667,I651,S
408,0,3,"Sdycoff, Mr. Todor",male,69,0,0,349222,7.8958,G252,S
409,0,3,"Hart, Mr. Henry",male,26,0,0,394140,6.8583,V106,Q
410,1,1,"Minahan, Miss. Daisy E",female,43,1,0,19928,90,U335,Q
411,0,2,"Cunningham, Mr. Alfred Fleming",male,76,0,0,239853,0,N512,S
412,1,3,"Sundman, Mr. Johan Julian",male,12,0,0,STON/O 2. 3101269,7.925,U461,S
413,0,3,"Meek, Mrs. Thomas (Annie Louise Rowley)",female,45,0,0,343095,8.05,A521,S
414,1,2,"Drew, Mrs. James Vivian (Lulu Thorne Christian)",female,37,1,1,28220,32.5,K626,S
415,1,2,"Silven, Miss. Lyyli Karoliina",female,52,0,2,250652,13,M956,S
416,0,2,"Matthews, Mr. William John",male,58,0,0,28228,13,K790,S
417,0,3,"Van Impe, Miss. Catharina",female,73,0,2,345773,24.15,J954,S
418,0,3,"Gheorgheff, Mr. Stanio",male,23,0,0,349254,7.8958,N413,C
419,0,3,"Charters, Mr. David",male,33,0,0,A/5. 13032,7.7333,W688,Q
420,0,3,"Zimmerman, Mr. Leo",male,7,0,0,315082,7.875,C449,S
421,0,3,"Danbom, Mrs. Ernst Gilbert (Anna Sigrid Maria Brogren)",female,73,1,1,347080,14.4,E452,S
422,0,3,"Rosblom, Mr. Viktor Richard",male,28,1,1,370129,20.2125,Y408,S
423,0,3,"Wiseman, Mr. Phillippe",male,63,0,0,A/4. 34244,7.25,N516,S
424,1,2,"Clarke, Mrs. Charles V (Ada Maria Winfield)",female,55,1,0,2003,26,H353,S
425,1,2,"Phillips, Miss. Kate Florence (""Mrs Kate Louise Phillips Marshall"")",female,35,0,0,250655,26,Z497,S
426,0,3,"Flynn, Mr. James",male,74,0,0,364851,7.75,Z791,Q
427,1,3,"Pickard, Mr. Berk (Berk Trembisky)",male,19,0,0,SOTON/O.Q. 392078,8.05,C641,S
428,1,1,"Bjornstrom-Steffansson, Mr. Mauritz Hakan",male,38,0,0,110564,26.55,Y863,S
429,1,3,"Thorneycroft, Mrs. Percival (Florence Kate White)",female,48,1,0,376564,16.1,Z370,S
430,1,2,"Louch, Mrs. Charles Alexander (Alice Adelaide Slow)",female,46,1,0,SC/AH 3085,26,V239,S
431,0,3,"Kallio, Mr. Nikolai Erland",male,32,0,0,STON/O 2. 3101274,7.125,B424,S
432,0,1,"Silvey, Mr. William Baird",male,17,1,0,13507,55.9,Y980,S
433,1,1,"Carter, Miss. Lucile Polk",female,55,1,2,113760,120,K569,S
434,0,3,"Ford, Miss. Doolina Margaret ""Daisy""",female,80,2,2,W./C. 6608,34.375,F731,S
435,1,2,"Richards, Mrs. Sidney (Emily Hocking)",female,15,2,3,29106,18.75,E429,S
436,0,1,"Fortune, Mr. Mark",male,68,1,4,19950,263,Z111,S
437,0,2,"Kvillner, Mr. Johan Henrik Johannesson",male,38,0,0,C.A. 18723,10.5,R314,S
438,1,2,"Hart, Mrs. Benjamin (Esther Ada Bloomfield)",female,9,1,1,F.C.C. 13529,26.25,Q992,S
439,0,3,"Hampe, Mr. Leon",male,28,0,0,345769,9.5,C375,S
440,0,3,"Petterson, Mr. Johan Emil",male,25,1,0,347076,7.775,O320,S
441,1,2,"Reynaldo, Ms. Encarnacion",female,13,0,0,230434,13,G883,S
442,1,3,"Johannesen-Bratthammer, Mr. Bernt",male,19,0,0,65306,8.1125,G807,S
443,1,1,"Dodge, Master. Washington",male,23,0,2,33638,81.8583,J651,S
444,1,2,"Mellinger, Miss. Madeleine Violet",female,66,0,1,250644,19.5,K702,S
445,1,1,"Seward, Mr. Frederic Kimber",male,27,0,0,113794,26.55,N120,S
446,1,3,"Baclini, Miss. Marie Catherine",female,19,2,1,2666,19.2583,P383,C
447,1,1,"Peuchen, Major. Arthur Godfrey",male,27,0,0,113786,30.5,Q335,S
448,0,2,"West, Mr. Edwy Arthur",male,32,1,2,C.A. 34651,27.75,Q856,S
449,0,3,"Hagland, Mr. Ingvald Olai Olsen",male,42,1,0,65303,19.9667,U965,S
450,0,1,"Foreman, Mr. Benjamin Laventall",male,22,0,0,113051,27.75,J868,C
451,1,1,"Goldenberg, Mr. Samuel L",male,31,1,0,17453,89.1042,G997,C
452,0,3,"Peduzzi, Mr. Joseph",male,80,0,0,A/5 2817,8.05,S153,S
453,1,3,"Jalsevac, Mr. Ivan",male,60,0,0,349240,7.8958,Q435,C
454,0,1,"Millet, Mr. Francis Davis",male,64,0,0,13509,26.55,K402,S
455,1,1,"Kenyon, Mrs. Frederick R (Marion)",female,13,1,0,17464,51.8625,L486,S
456,1,2,"Toomey, Miss. Ellen",female,38,0,0,F.C.C. 13531,10.5,C537,S
457,0,3,"O'Connor, Mr. Maurice",male,35,0,0,371060,7.75,K742,Q
458,1,1,"Anderson, Mr. Harry",male,50,0,0,19952,26.55,O404,S
459,0,3,"Morley, Mr. William",male,61,0,0,364506,8.05,W129,S
460,0,1,"Gee, Mr. Arthur H",male,79,0,0,111320,38.5,D100,S
461,0,2,"Milling, Mr. Jacob Christian",male,10,0,0,234360,13,C856,S
462,0,3,"Maisner, Mr. Simon",male,25,0,0,A/S 2816,8.05,A567,S
463,0,3,"Goncalves, Mr. Manuel Estanslas",male,53,0,0,SOTON/O.Q. 3101306,7.05,B956,S
464,0,2,"Campbell, Mr. William",male,26,0,0,239853,0,D906,S
465,0,1,"Smart, Mr. John Montgomery",male,71,0,0,113792,26.55,M529,S
466,0,3,"Scanlan, Mr. James",male,12,0,0,36209,7.725,N256,Q
467,1,3,"Baclini, Miss. Helene Barbara",female,11,2,1,2666,19.2583,H677,C
468,0,3,"Keefe, Mr. Arthur",male,72,0,0,323592,7.25,A341,S
469,0,3,"Cacic, Mr. Luka",male,20,0,0,315089,8.6625,S218,S
470,1,2,"West, Mrs. Edwy Arthur (Ada Mary Worth)",female,69,1,2,C.A. 34651,27.75,J317,S
471,1,2,"Jerwan, Mrs. Amin S (Marie Marthe Thuillard)",female,20,0,0,SC/AH Basle 541,13.7917,S222,C
472,0,3,"Strandberg, Miss. Ida Sofia",female,20,0,0,7553,9.8375,H940,S
473,0,1,"Clifford, Mr. George Quincy",male,63,0,0,110465,52,K563,S
474,0,2,"Renouf, Mr. Peter Henry",male,9,1,0,31027,21,Q146,S
475,0,3,"Braund, Mr. Lewis Richard",male,22,1,0,3460,7.0458,W266,S
476,0,3,"Karlsson, Mr. Nils August",male,50,0,0,350060,7.5208,J234,S
477,1,3,"Hirvonen, Miss. Hildur E",female,30,0,1,3101298,12.2875,C612,S
478,0,3,"Goodwin, Master. Harold Victor",male,76,5,2,CA 2144,46.9,X676,S
479,0,2,"Frost, Mr. Anthony Wood ""Archie""",male,51,0,0,239854,0,J293,S
480,0,3,"Rouse, Mr. Richard Henry",male,53,0,0,A/5 3594,8.05,W603,S
481,1,3,"Turkula, Mrs. (Hedwig)",female,19,0,0,4134,9.5875,V308,S
482,1,1,"Bishop, Mr. Dickinson H",male,18,1,0,11967,91.0792,J113,C
483,0,3,"Lefebre, Miss. Jeannie",female,58,3,1,4133,25.4667,Z636,S
484,1,1,"Hoyt, Mrs. Frederick Maxfield (Jane Anne Forby)",female,6,1,0,19943,90,G730,S
485,0,1,"Kent, Mr. Edward Austin",male,72,0,0,11771,29.7,E393,C
486,0,3,"Somerton, Mr. Francis William",male,40,0,0,A.5. 18509,8.05,O225,S
487,1,3,"Coutts, Master. Eden Leslie ""Neville""",male,59,1,1,C.A. 37671,15.9,G782,S
488,0,3,"Hagland, Mr. Konrad Mathias Reiersen",male,11,1,0,65304,19.9667,S939,S
489,0,3,"Windelov, Mr. Einar",male,19,0,0,SOTON/OQ 3101317,7.25,B879,S
490,0,1,"Molson, Mr. Harry Markland",male,34,0,0,113787,30.5,L185,S
491,0,1,"Artagaveytia, Mr. Ramon",male,10,0,0,PC 17609,49.5042,T541,C
492,0,3,"Stanley, Mr. Edward Roland",male,57,0,0,A/4 45380,8.05,M167,S
493,0,3,"Yousseff, Mr. Gerious",male,54,0,0,2627,14.4583,I768,C
494,1,1,"Eustis, Miss. Elizabeth Mussey",female,74,1,0,36947,78.2667,W884,C
495,0,3,"Shellard, Mr. Frederick William",male,48,0,0,C.A. 6212,15.1,Z222,S
496,0,1,"Allison, Mrs. Hudson J C (Bessie Waldo Daniels)",female,76,1,2,113781,151.55,S623,S
497,0,3,"Svensson, Mr. Olof",male,57,0,0,350035,7.7958,R993,S
498,0,3,"Calic, Mr. Petar",male,47,0,0,315086,8.6625,H478,S
499,0,3,"Canavan, Miss. Mary",female,78,0,0,364846,7.75,V212,Q
500,0,3,"O'Sullivan, Miss. Bridget Mary",female,38,0,0,330909,7.6292,Y876,Q
501,0,3,"Laitinen, Miss. Kristina Sofia",female,27,0,0,4135,9.5875,M941,S
502,1,1,"Maioni, Miss. Roberta",female,78,0,0,110152,86.5,L779,S
503,0,1,"Penasco y Castellana, Mr. Victor de Satode",male,43,1,0,PC 17758,108.9,C316,C
504,1,2,"Quick, Mrs. Frederick Charles (Jane Richards)",female,11,0,2,26360,26,A979,S
505,1,1,"Bradley, Mr. George (""George Arthur Brayton"")",male,80,0,0,111427,26.55,M783,S
506,0,3,"Olsen, Mr. Henry Margido",male,37,0,0,C 4001,22.525,A790,S
507,1,3,"Lang, Mr. Fang",male,13,0,0,1601,56.4958,H835,S
508,1,3,"Daly, Mr. Eugene Patrick",male,23,0,0,382651,7.75,O715,Q
509,0,3,"Webber, Mr. James",male,73,0,0,SOTON/OQ 3101316,8.05,W639,S
510,1,1,"McGough, Mr. James Robert",male,40,0,0,PC 17473,26.2875,S499,S
511,1,1,"Rothschild, Mrs. Martin (Elizabeth L. Barrett)",female,71,1,0,PC 17603,59.4,Q959,C
512,0,3,"Coleff, Mr. Satio",male,13,0,0,349209,7.4958,W281,S
513,0,1,"Walker, Mr. William Anderson",male,72,0,0,36967,34.0208,Q282,S
514,1,2,"Lemore, Mrs. (Amelia Milley)",female,31,0,0,C.A. 34260,10.5,L332,S
515,0,3,"Ryan, Mr. Patrick",male,17,0,0,371110,24.15,G621,Q
516,1,2,"Angle, Mrs. William A (Florence ""Mary"" Agnes Hughes)",female,19,1,0,226875,26,V408,S
517,0,3,"Pavlovic, Mr. Stefo",male,35,0,0,349242,7.8958,B128,S
518,1,1,"Perreault, Miss. Anne",female,35,0,0,12749,93.5,T217,S
519,0,3,"Vovk, Mr. Janko",male,80,0,0,349252,7.8958,U186,S
520,0,3,"Lahoud, Mr. Sarkis",male,46,0,0,2624,7.225,I389,C
521,1,1,"Hippach, Mrs. Louis Albert (Ida Sophia Fischer)",female,42,0,1,111361,57.9792,S658,C
522,0,3,"Kassem, Mr. Fared",male,55,0,0,2700,7.2292,K735,C
523,0,3,"Farrell, Mr. James",male,77,0,0,367232,7.75,A267,Q
524,1,2,"Ridsdale, Miss. Lucy",female,19,0,0,W./C. 14258,10.5,K730,S
525,0,1,"Farthing, Mr. John",male,25,0,0,PC 17483,221.7792,R486,S
526,0,3,"Salonen, Mr. Johan Werner",male,57,0,0,3101296,7.925,D721,S
527,0,2,"Hocking, Mr. Richard George",male,63,2,1,29104,11.5,H659,S
528,1,2,"Quick, Miss. Phyllis May",female,16,1,1,26360,26,X445,S
529,0,3,"Toufik, Mr. Nakli",male,38,0,0,2641,7.2292,V343,C
530,0,3,"Elias, Mr. Joseph Jr",male,15,1,1,2690,7.2292,X834,C
531,1,3,"Peter, Mrs. Catherine (Catherine Rizk)",female,30,0,2,2668,22.3583,A243,C
532,0,3,"Cacic, Miss. Marija",female,69,0,0,315084,8.6625,O555,S
533,1,2,"Hart, Miss. Eva Miriam",female,40,0,2,F.C.C. 13529,26.25,D701,S
534,0,1,"Butt, Major. Archibald Willingham",male,14,0,0,113050,26.55,K487,S
535,1,1,"LeRoy, Miss. Bertha",female,27,0,0,PC 17761,106.425,S176,C
536,0,3,"Risien, Mr. Samuel Beard",male,25,0,0,364498,14.5,N761,S
537,1,1,"Frolicher, Miss. Hedwig Margaritha",female,11,0,2,13568,49.5,B329,C
538,1,1,"Crosby, Miss. Harriet R",female,45,0,2,WE/P 5735,71,O928,S
539,0,3,"Andersson, Miss. Ingeborg Constanzia",female,51,4,2,347082,31.275,L612,S
540,0,3,"Andersson, Miss. Sigrid Elisabeth",female,20,4,2,347082,31.275,R847,S
541,1,2,"Beane, Mr. Edward",male,66,1,0,2908,26,Y740,S
542,0,1,"Douglas, Mr. Walter Donald",male,34,1,0,PC 17761,106.425,X767,C
543,0,1,"Nicholson, Mr. Arthur Ernest",male,53,0,0,693,26,F917,S
544,1,2,"Beane, Mrs. Edward (Ethel Clarke)",female,73,1,0,2908,26,C337,S
545,1,2,"Padro y Manent, Mr. Julian",male,10,0,0,SC/PARIS 2146,13.8625,B483,C
546,0,3,"Goldsmith, Mr. Frank John",male,22,1,1,363291,20.525,V718,S
547,1,2,"Davies, Master. John Morgan Jr",male,15,1,1,C.A. 33112,36.75,A343,S
548,1,1,"Thayer, Mr. John Borland Jr",male,54,0,2,17421,110.8833,M665,C
549,0,2,"Sharp, Mr. Percival James R",male,39,0,0,244358,26,I203,S
550,0,3,"O'Brien, Mr. Timothy",male,50,0,0,330979,7.8292,J787,Q
551,1,3,"Leeni, Mr. Fahim (""Philip Zenni"")",male,7,0,0,2620,7.225,X147,C
552,1,3,"Ohman, Miss. Velin",female,28,0,0,347085,7.775,M622,S
553,0,1,"Wright, Mr. George",male,34,0,0,113807,26.55,F400,S
554,1,1,"Duff Gordon, Lady. (Lucille Christiana Sutherland) (""Mrs Morgan"")",female,27,1,0,11755,39.6,C147,C
555,0,1,"Robbins, Mr. Victor",male,56,0,0,PC 17757,227.525,S122,C
556,1,1,"Taussig, Mrs. Emil (Tillie Mandelbaum)",female,48,1,1,110413,79.65,A333,S
557,1,3,"de Messemaeker, Mrs. Guillaume Joseph (Emma)",female,52,1,0,345572,17.4,Z659,S
558,0,3,"Morrow, Mr. Thomas Rowan",male,23,0,0,372622,7.75,J816,Q
559,0,3,"Sivic, Mr. Husein",male,41,0,0,349251,7.8958,C492,S
560,0,2,"Norman, Mr. Robert Douglas",male,19,0,0,218629,13.5,J165,S
561,0,3,"Simmons, Mr. John",male,57,0,0,SOTON/OQ 392082,8.05,V261,S
562,0,3,"Meanwell, Miss. (Marion Ogden)",female,25,0,0,SOTON/O.Q. 392087,8.05,P894,S
563,0,3,"Davies, Mr. Alfred J",male,59,2,0,A/4 48871,24.15,R805,S
564,0,3,"Stoytcheff, Mr. Ilia",male,41,0,0,349205,7.8958,A721,S
565,0,3,"Palsson, Mrs. Nils (Alma Cornelia Berglund)",female,56,0,4,349909,21.075,V570,S
566,0,3,"Doharr, Mr. Tannous",male,66,0,0,2686,7.2292,S171,C
567,1,3,"Jonsson, Mr. Carl",male,10,0,0,350417,7.8542,H736,S
568,1,2,"Harris, Mr. George",male,14,0,0,S.W./PP 752,10.5,S435,S
569,1,1,"Appleton, Mrs. Edward Dale (Charlotte Lamson)",female,62,2,0,11769,51.4792,B715,S
570,1,1,"Flynn, Mr. John Irwin (""Irving"")",male,20,0,0,PC 17474,26.3875,M137,S
571,1,3,"Kelly, Miss. Mary",female,47,0,0,14312,7.75,I542,Q
572,0,3,"Rush, Mr. Alfred George John",male,27,0,0,A/4. 20589,8.05,H879,S
573,0,3,"Patchett, Mr. George",male,19,0,0,358585,14.5,A641,S
574,1,2,"Garside, Miss. Ethel",female,36,0,0,243880,13,Z940,S
575,1,1,"Silvey, Mrs. William Baird (Alice Munger)",female,11,1,0,13507,55.9,A441,S
576,0,3,"Caram, Mrs. Joseph (Maria Elias)",female,16,1,0,2689,14.4583,M250,C
577,1,3,"Jussila, Mr. Eiriik",male,19,0,0,STON/O 2. 3101286,7.925,S262,S
578,1,2,"Christy, Miss. Julie Rachel",female,52,1,1,237789,30,N200,S
579,1,1,"Thayer, Mrs. John Borland (Marian Longstreth Morris)",female,66,1,1,17421,110.8833,K406,C
580,0,2,"Downton, Mr. William James",male,62,0,0,28403,26,N460,S
581,0,1,"Ross, Mr. John Hugo",male,57,0,0,13049,40.125,U305,C
582,0,3,"Paulner, Mr. Uscher",male,52,0,0,3411,8.7125,B887,C
583,1,1,"Taussig, Miss. Ruth",female,42,0,2,110413,79.65,C745,S
584,0,2,"Jarvis, Mr. John Denzil",male,49,0,0,237565,15,A563,S
585,1,1,"Frolicher-Stehli, Mr. Maxmillian",male,6,1,1,13567,79.2,L198,C
586,0,3,"Gilinski, Mr. Eliezer",male,32,0,0,14973,8.05,H962,S
587,0,3,"Murdlin, Mr. Joseph",male,46,0,0,A./5. 3235,8.05,J588,S
588,0,3,"Rintamaki, Mr. Matti",male,31,0,0,STON/O 2. 3101273,7.125,K284,S
589,1,1,"Stephenson, Mrs. Walter Bertram (Martha Eustis)",female,18,1,0,36947,78.2667,V292,C
590,0,3,"Elsbury, Mr. William James",male,76,0,0,A/5 3902,7.25,P634,S
591,0,3,"Bourke, Miss. Mary",female,60,0,2,364848,7.75,F195,Q
592,0,2,"Chapman, Mr. John Henry",male,34,1,0,SC/AH 29037,26,C623,S
593,0,3,"Van Impe, Mr. Jean Baptiste",male,80,1,1,345773,24.15,A313,S
594,1,2,"Leitch, Miss. Jessie Wills",female,7,0,0,248727,33,E370,S
595,0,3,"Johnson, Mr. Alfred",male,20,0,0,LINE,0,D859,S
596,0,3,"Boulos, Mr. Hanna",male,52,0,0,2664,7.225,I351,C
597,1,1,"Duff Gordon, Sir. Cosmo Edmund (""Mr Morgan"")",male,30,1,0,PC 17485,56.9292,O505,C
598,1,2,"Jacobsohn, Mrs. Sidney Samuel (Amy Frances Christy)",female,19,2,1,243847,27,O408,S
599,0,3,"Slabenoff, Mr. Petco",male,14,0,0,349214,7.8958,L413,S
600,0,1,"Harrington, Mr. Charles H",male,39,0,0,113796,42.4,A641,S
601,0,3,"Torber, Mr. Ernst William",male,68,0,0,364511,8.05,S605,S
602,1,1,"Homer, Mr. Harry (""Mr E Haven"")",male,20,0,0,111426,26.55,Y972,C
603,0,3,"Lindell, Mr. Edvard Bengtsson",male,64,1,0,349910,15.55,W229,S
604,0,3,"Karaic, Mr. Milan",male,53,0,0,349246,7.8958,I559,S
605,1,1,"Daniel, Mr. Robert Williams",male,17,0,0,113804,30.5,W187,S
606,1,2,"Laroche, Mrs. Joseph (Juliette Marie Louise Lafargue)",female,35,1,2,SC/Paris 2123,41.5792,A847,C
607,1,1,"Shutes, Miss. Elizabeth W",female,41,0,0,PC 17582,153.4625,V930,S
608,0,3,"Andersson, Mrs. Anders Johan (Alfrida Konstantia Brogren)",female,54,1,5,347082,31.275,Q412,S
609,0,3,"Jardin, Mr. Jose Neto",male,42,0,0,SOTON/O.Q. 3101305,7.05,N713,S
610,1,3,"Murphy, Miss. Margaret Jane",female,46,1,0,367230,15.5,F430,Q
611,0,3,"Horgan, Mr. John",male,67,0,0,370377,7.75,F935,Q
612,0,3,"Brocklebank, Mr. William Alfred",male,59,0,0,364512,8.05,L400,S
613,1,2,"Herman, Miss. Alice",female,79,1,2,220845,65,D789,S
614,0,3,"Danbom, Mr. Ernst Gilbert",male,61,1,1,347080,14.4,O741,S
615,0,3,"Lobb, Mrs. William Arthur (Cordelia K Stanlick)",female,15,1,0,A/5. 3336,16.1,W996,S
616,1,2,"Becker, Miss. Marion Louise",female,38,2,1,230136,39,I146,S
617,0,2,"Gavey, Mr. Lawrence",male,49,0,0,31028,10.5,B106,S
618,0,3,"Yasbeck, Mr. Antoni",male,20,1,0,2659,14.4542,H265,C
619,1,1,"Kimball, Mr. Edwin Nelson Jr",male,44,1,0,11753,52.5542,L110,S
620,1,3,"Nakid, Mr. Sahid",male,42,1,1,2653,15.7417,V207,C
621,0,3,"Hansen, Mr. Henry Damsgaard",male,53,0,0,350029,7.8542,B888,S
622,0,3,"Bowen, Mr. David John ""Dai""",male,10,0,0,54636,16.1,T150,S
623,0,1,"Sutton, Mr. Frederick",male,79,0,0,36963,32.3208,L440,S
624,0,2,"Kirkland, Rev. Charles Leonard",male,67,0,0,219533,12.35,Y184,Q
625,1,1,"Longley, Miss. Gretchen Fiske",female,20,0,0,13502,77.9583,C800,S
626,0,3,"Bostandyeff, Mr. Guentcho",male,17,0,0,349224,7.8958,B411,S
627,0,3,"O'Connell, Mr. Patrick D",male,47,0,0,334912,7.7333,L945,Q
628,1,1,"Barkworth, Mr. Algernon Henry Wilson",male,22,0,0,27042,30,U571,S
629,0,3,"Lundahl, Mr. Johan Svensson",male,68,0,0,347743,7.0542,E668,S
630,1,1,"Stahelin-Maeglin, Dr. Max",male,59,0,0,13214,30.5,Y837,C
631,0,1,"Parr, Mr. William Henry Marsh",male,79,0,0,112052,0,F782,S
632,0,3,"Skoog, Miss. Mabel",female,15,3,2,347088,27.9,E851,S
633,1,2,"Davis, Miss. Mary",female,28,0,0,237668,13,H176,S
634,0,3,"Leinonen, Mr. Antti Gustaf",male,16,0,0,STON/O 2. 3101292,7.925,X385,S
635,0,2,"Collyer, Mr. Harvey",male,24,1,1,C.A. 31921,26.25,Q174,S
636,0,3,"Panula, Mrs. Juha (Maria Emilia Ojala)",female,80,0,5,3101295,39.6875,Z917,S
637,0,3,"Thorneycroft, Mr. Percival",male,59,1,0,376564,16.1,Q805,S
638,0,3,"Jensen, Mr. Hans Peder",male,44,0,0,350050,7.8542,E114,S
639,1,1,"Sagesser, Mlle. Emma",female,23,0,0,PC 17477,69.3,H600,C
640,0,3,"Skoog, Miss. Margit Elizabeth",female,70,3,2,347088,27.9,X419,S
641,1,3,"Foo, Mr. Choong",male,27,0,0,1601,56.4958,W574,S
642,1,3,"Baclini, Miss. Eugenie",female,42,2,1,2666,19.2583,W637,C
643,1,1,"Harper, Mr. Henry Sleeper",male,45,1,0,PC 17572,76.7292,B855,C
644,0,3,"Cor, Mr. Liudevit",male,68,0,0,349231,7.8958,F779,S
645,1,1,"Simonius-Blumer, Col. Oberst Alfons",male,57,0,0,13213,35.5,Y223,C
646,0,3,"Willey, Mr. Edward",male,56,0,0,S.O./P.P. 751,7.55,B957,S
647,1,3,"Stanley, Miss. Amy Zillah Elsie",female,10,0,0,CA. 2314,7.55,X729,S
648,0,3,"Mitkoff, Mr. Mito",male,65,0,0,349221,7.8958,M437,S
649,1,2,"Doling, Miss. Elsie",female,68,0,1,231919,23,P852,S
650,0,3,"Kalvik, Mr. Johannes Halvorsen",male,14,0,0,8475,8.4333,I316,S
651,1,3,"O'Leary, Miss. Hanora ""Norah""",female,59,0,0,330919,7.8292,Y896,Q
652,0,3,"Hegarty, Miss. Hanora ""Nora""",female,38,0,0,365226,6.75,W364,Q
653,0,2,"Hickman, Mr. Leonard Mark",male,42,2,0,S.O.C. 14879,73.5,H507,S
654,0,3,"Radeff, Mr. Alexander",male,28,0,0,349223,7.8958,T109,S
655,0,3,"Bourke, Mrs. John (Catherine)",female,60,1,1,364849,15.5,Y207,Q
656,0,2,"Eitemiller, Mr. George Floyd",male,67,0,0,29751,13,Y356,S
657,0,1,"Newell, Mr. Arthur Webster",male,30,0,2,35273,113.275,H139,C
658,1,1,"Frauenthal, Dr. Henry William",male,48,2,0,PC 17611,133.65,Y602,S
659,0,3,"Badt, Mr. Mohamed",male,26,0,0,2623,7.225,L378,C
660,0,1,"Colley, Mr. Edward Pomeroy",male,37,0,0,5727,25.5875,G818,S
661,0,3,"Coleff, Mr. Peju",male,16,0,0,349210,7.4958,N384,S
662,1,3,"Lindqvist, Mr. Eino William",male,65,1,0,STON/O 2. 3101285,7.925,Z108,S
663,0,2,"Hickman, Mr. Lewis",male,68,2,0,S.O.C. 14879,73.5,P817,S
664,0,2,"Butler, Mr. Reginald Fenton",male,31,0,0,234686,13,D527,S
665,0,3,"Rommetvedt, Mr. Knud Paust",male,8,0,0,312993,7.775,F682,S
666,0,3,"Cook, Mr. Jacob",male,78,0,0,A/5 3536,8.05,J546,S
667,1,1,"Taylor, Mrs. Elmer Zebley (Juliet Cummins Wright)",female,24,1,0,19996,52,J712,S
668,1,2,"Brown, Mrs. Thomas William Solomon (Elizabeth Catherine Ford)",female,43,1,1,29750,39,H225,S
669,0,1,"Davidson, Mr. Thornton",male,8,1,0,F.C. 12750,52,S315,S
670,0,2,"Mitchell, Mr. Henry Michael",male,23,0,0,C.A. 24580,10.5,Q220,S
671,1,2,"Wilhelms, Mr. Charles",male,30,0,0,244270,13,W534,S
672,0,2,"Watson, Mr. Ennis Hastings",male,64,0,0,239856,0,U408,S
673,0,3,"Edvardsson, Mr. Gustaf Hjalmar",male,28,0,0,349912,7.775,M190,S
674,0,3,"Sawyer, Mr. Frederick Charles",male,76,0,0,342826,8.05,F616,S
675,1,3,"Turja, Miss. Anna Sofia",female,18,0,0,4138,9.8417,U101,S
676,0,3,"Goodwin, Mrs. Frederick (Augusta Tyler)",female,67,1,6,CA 2144,46.9,H366,S
677,1,1,"Cardeza, Mr. Thomas Drake Martinez",male,20,0,1,PC 17755,512.3292,S644,C
678,0,3,"Peters, Miss. Katie",female,9,0,0,330935,8.1375,U793,Q
679,1,1,"Hassab, Mr. Hammad",male,75,0,0,PC 17572,76.7292,Y386,C
680,0,3,"Olsvigen, Mr. Thor Anderson",male,17,0,0,6563,9.225,K876,S
681,0,3,"Goodwin, Mr. Charles Edward",male,57,5,2,CA 2144,46.9,I856,S
682,0,2,"Brown, Mr. Thomas William Solomon",male,59,1,1,29750,39,Y865,S
683,0,2,"Laroche, Mr. Joseph Philippe Lemercier",male,36,1,2,SC/Paris 2123,41.5792,C587,C
684,0,3,"Panula, Mr. Jaako Arnold",male,21,4,1,3101295,39.6875,D163,S
685,0,3,"Dakic, Mr. Branko",male,32,0,0,349228,10.1708,I947,S
686,0,3,"Fischer, Mr. Eberhard Thelander",male,62,0,0,350036,7.7958,P413,S
687,1,1,"Madill, Miss. Georgette Alexandra",female,36,0,1,24160,211.3375,I949,S
688,1,1,"Dick, Mr. Albert Adrian",male,12,1,0,17474,57,W246,S
689,1,3,"Karun, Miss. Manca",female,49,0,1,349256,13.4167,X659,C
690,1,3,"Lam, Mr. Ali",male,27,0,0,1601,56.4958,D331,S
691,0,3,"Saad, Mr. Khalil",male,47,0,0,2672,7.225,A674,C
692,0,1,"Weir, Col. John",male,65,0,0,113800,26.55,K487,S
693,0,2,"Chapman, Mr. Charles Henry",male,24,0,0,248731,13.5,I539,S
694,0,3,"Kelly, Mr. James",male,57,0,0,363592,8.05,Y505,S
695,1,3,"Mullens, Miss. Katherine ""Katie""",female,76,0,0,35852,7.7333,Y535,Q
696,0,1,"Thayer, Mr. John Borland",male,38,1,1,17421,110.8833,M637,C
697,0,3,"Humblen, Mr. Adolf Mathias Nicolai Olsen",male,58,0,0,348121,7.65,R138,S
698,1,1,"Astor, Mrs. John Jacob (Madeleine Talmadge Force)",female,36,1,0,PC 17757,227.525,Q261,C
699,1,1,"Silverthorne, Mr. Spencer Victor",male,70,0,0,PC 17475,26.2875,H122,S
700,0,3,"Barbara, Miss. Saiide",female,69,0,1,2691,14.4542,J469,C
701,0,3,"Gallagher, Mr. Martin",male,15,0,0,36864,7.7417,H208,Q
702,0,3,"Hansen, Mr. Henrik Juul",male,15,1,0,350025,7.8542,K190,S
703,0,2,"Morley, Mr. Henry Samuel (""Mr Henry Marshall"")",male,26,0,0,250655,26,T733,S
704,1,2,"Kelly, Mrs. Florence ""Fannie""",female,73,0,0,223596,13.5,W859,S
705,1,1,"Calderhead, Mr. Edward Pennington",male,39,0,0,PC 17476,26.2875,Y444,S
706,1,1,"Cleaver, Miss. Alice",female,71,0,0,113781,151.55,E110,S
707,1,3,"Moubarek, Master. Halim Gonios (""William George"")",male,19,1,1,2661,15.2458,Y855,C
708,1,1,"Mayne, Mlle. Berthe Antonine (""Mrs de Villiers"")",female,65,0,0,PC 17482,49.5042,J336,C
709,0,1,"Klaber, Mr. Herman",male,73,0,0,113028,26.55,O544,S
710,1,1,"Taylor, Mr. Elmer Zebley",male,20,1,0,19996,52,P541,S
711,0,3,"Larsson, Mr. August Viktor",male,31,0,0,7545,9.4833,U862,S
712,0,2,"Greenberg, Mr. Samuel",male,40,0,0,250647,13,Q875,S
713,0,3,"Soholt, Mr. Peter Andreas Lauritz Andersen",male,21,0,0,348124,7.65,K170,S
714,1,1,"Endres, Miss. Caroline Louise",female,26,0,0,PC 17757,227.525,B944,C
715,1,2,"Troutt, Miss. Edwina Celia ""Winnie""",female,17,0,0,34218,10.5,Y759,S
716,0,3,"McEvoy, Mr. Michael",male,13,0,0,36568,15.5,U381,Q
717,0,3,"Johnson, Mr. Malkolm Joackim",male,18,0,0,347062,7.775,Q540,S
